{
  "schemaVersion": "cairnmap.workflow.v1",
  "projectId": "openriamap-ria",
  "id": "building-workflow",
  "label": "Building workflow",
  "runtimeStatus": "active",
  "targetClass": "BUD",
  "targetGeometry": "Polygon",
  "runtimeMode": "componentExecutor",
  "componentKey": "buildingWorkflow",
  "legacyWorkflowKey": "建筑",
  "blockRunnerReady": false,
  "futureBlockTemplateRef": "basic-polygon-4step",
  "executorDispatch": "configComponentKey",
  "legacyFallback": true,
  "notes": "Current runtime dispatches this workflow to a registered TS component executor. Fine-grained block/page assembly is intentionally not stored in the active workflow JSON."
}
