{
  "schemaVersion": "cairnmap.workflow.v1",
  "projectId": "openriamap-ria",
  "id": "road-workflow",
  "label": "Road workflow",
  "runtimeStatus": "active",
  "targetClass": "ROD",
  "targetGeometry": "LineString",
  "runtimeMode": "componentExecutor",
  "componentKey": "roadWorkflow",
  "legacyWorkflowKey": "道路",
  "blockRunnerReady": false,
  "futureBlockTemplateRef": "basic-line-3step",
  "executorDispatch": "configComponentKey",
  "legacyFallback": true,
  "notes": "Current runtime dispatches this workflow to a registered TS component executor. Fine-grained block/page assembly is intentionally not stored in the active workflow JSON."
}
