{
  "schemaVersion": "cairnmap.workflow.v1",
  "projectId": "openriamap-ria",
  "id": "rail-platform-boundary-workflow",
  "label": "Rail platform boundary workflow",
  "runtimeStatus": "active",
  "targetClass": "PFB",
  "targetGeometry": "Polygon",
  "runtimeMode": "componentExecutor",
  "componentKey": "stationWorkflow",
  "legacyWorkflowKey": "站台轮廓",
  "blockRunnerReady": false,
  "futureBlockTemplateRef": "basic-polygon-4step",
  "executorDispatch": "configComponentKey",
  "legacyFallback": true,
  "notes": "Current runtime dispatches this workflow to a registered TS component executor. Fine-grained block/page assembly is intentionally not stored in the active workflow JSON."
}
